{
  "ok": true,
  "action": "rollback_prepare",
  "request_id": "req-20260311-147000-sample08",
  "task_id": "task-sample-rollback",
  "status": "ok",
  "message": "Rollback preparation completed — prepare-only metadata, actual rollback requires operator action in LiveUSB/rescue environment",
  "artifacts": {
    "target_snapshot": "root-pre-pre-config-deploy-20260311",
    "reason": "Config deploy caused gateway failure",
    "snapshot_path": "/.snapshots/root-pre-pre-config-deploy-20260311",
    "snapshot_verified": true,
    "prepare_only": true,
    "rollback_executed": false,
    "scope": "root-filesystem-only",
    "excluded_paths": ["/var/lib/openclaw"],
    "operator_action_required": true,
    "mode": "live"
  },
  "rollback_hint": "Rollback preparation is read-only; no undo needed"
}
