{
  "ok": true,
  "action": "snapshot_post",
  "request_id": "req-20260311-145000-sample06",
  "task_id": "task-sample-snapshot-post",
  "status": "ok",
  "message": "Post-change snapshot created",
  "artifacts": {
    "snapshot_name": "root-post-post-config-deploy-20260311",
    "label": "post-config-deploy-20260311",
    "reason": "Post-change snapshot after config deploy"
  },
  "rollback_hint": "Delete snapshot: btrfs subvolume delete /.snapshots/root-post-post-config-deploy-20260311"
}
